{
  "event_slug": "2026-seoul-mayor",
  "captured_at": "2026-05-09T12:00:00Z",
  "method": "nesdc_scrape",
  "method_notes": "Binary (양자대결) head-to-head polls sourced from MBC/KoreaResearch, SBS/Ipsos, KBS/KStat, Gallup-Korea/Segye, Realmeter/OhmyNews, JoWon C&I/StraightNews, and YeoronjosakotFlower; series covers ISO 2025-W50 through 2026-W19 with gaps in W51, W02–W03, W05–W06, W08, W11–W14, and W16; ARS-based polls (조원씨앤아이, KSOI) may overstate 정원오's lead relative to CATI polls, and the SBS May 1–3 (W18) entry is a multi-candidate ballot question with minor-party candidates accounting for ~2% of responses.",
  "interval": "1w",
  "candidates": [
    {
      "name": "Chong Won-oh",
      "name_ko": "정원오",
      "party_id": "dpk",
      "series": [
        {
          "t": "2025-12-08T00:00:00Z",
          "p": 0.452,
          "n_polls": 1,
          "sources": [
            "other-researchview"
          ]
        },
        {
          "t": "2025-12-22T00:00:00Z",
          "p": 0.4103,
          "n_polls": 3,
          "sources": [
            "korea-research",
            "other-jowon",
            "realmeter"
          ]
        },
        {
          "t": "2025-12-29T00:00:00Z",
          "p": 0.39,
          "n_polls": 1,
          "sources": [
            "other-metavoice"
          ]
        },
        {
          "t": "2026-01-19T00:00:00Z",
          "p": 0.492,
          "n_polls": 3,
          "sources": [
            "other-flowersurvey",
            "other-jowon"
          ]
        },
        {
          "t": "2026-02-09T00:00:00Z",
          "p": 0.4067,
          "n_polls": 3,
          "sources": [
            "korea-research",
            "other-ipsos",
            "other-kstat"
          ]
        },
        {
          "t": "2026-02-23T00:00:00Z",
          "p": 0.558,
          "n_polls": 1,
          "sources": [
            "other-jowon"
          ]
        },
        {
          "t": "2026-03-02T00:00:00Z",
          "p": 0.475,
          "n_polls": 1,
          "sources": [
            "other-jowon"
          ]
        },
        {
          "t": "2026-04-06T00:00:00Z",
          "p": 0.52,
          "n_polls": 1,
          "sources": [
            "gallup-korea"
          ]
        },
        {
          "t": "2026-04-20T00:00:00Z",
          "p": 0.4765,
          "n_polls": 2,
          "sources": [
            "other-jowon",
            "other-ksoi"
          ]
        },
        {
          "t": "2026-04-27T00:00:00Z",
          "p": 0.445,
          "n_polls": 2,
          "sources": [
            "korea-research",
            "other-ipsos"
          ]
        },
        {
          "t": "2026-05-04T00:00:00Z",
          "p": 0.502,
          "n_polls": 1,
          "sources": [
            "other-jowon"
          ]
        }
      ]
    },
    {
      "name": "Oh Se-hoon",
      "name_ko": "오세훈",
      "party_id": "ppp",
      "series": [
        {
          "t": "2025-12-08T00:00:00Z",
          "p": 0.381,
          "n_polls": 1,
          "sources": [
            "other-researchview"
          ]
        },
        {
          "t": "2025-12-22T00:00:00Z",
          "p": 0.369,
          "n_polls": 3,
          "sources": [
            "korea-research",
            "other-jowon",
            "realmeter"
          ]
        },
        {
          "t": "2025-12-29T00:00:00Z",
          "p": 0.38,
          "n_polls": 1,
          "sources": [
            "other-metavoice"
          ]
        },
        {
          "t": "2026-01-19T00:00:00Z",
          "p": 0.349,
          "n_polls": 3,
          "sources": [
            "other-flowersurvey",
            "other-jowon"
          ]
        },
        {
          "t": "2026-02-09T00:00:00Z",
          "p": 0.3433,
          "n_polls": 3,
          "sources": [
            "korea-research",
            "other-ipsos",
            "other-kstat"
          ]
        },
        {
          "t": "2026-02-23T00:00:00Z",
          "p": 0.324,
          "n_polls": 1,
          "sources": [
            "other-jowon"
          ]
        },
        {
          "t": "2026-03-02T00:00:00Z",
          "p": 0.333,
          "n_polls": 1,
          "sources": [
            "other-jowon"
          ]
        },
        {
          "t": "2026-04-06T00:00:00Z",
          "p": 0.37,
          "n_polls": 1,
          "sources": [
            "gallup-korea"
          ]
        },
        {
          "t": "2026-04-20T00:00:00Z",
          "p": 0.3565,
          "n_polls": 2,
          "sources": [
            "other-jowon",
            "other-ksoi"
          ]
        },
        {
          "t": "2026-04-27T00:00:00Z",
          "p": 0.33,
          "n_polls": 2,
          "sources": [
            "korea-research",
            "other-ipsos"
          ]
        },
        {
          "t": "2026-05-04T00:00:00Z",
          "p": 0.38,
          "n_polls": 1,
          "sources": [
            "other-jowon"
          ]
        }
      ]
    }
  ]
}
